{"batch_id":"synthetic-001","depends_on_batch_id":null,"feed_id":"tech-boundary-synthetic","from_version":0,"generated_at":"2026-09-09T00:00:00Z","generation":"test-v0","min_consumer_version":"0.1.0","payload_bytes":1432,"payload_path":"batch-synthetic-001.jsonl","payload_sha256":"6841589a95130b65da789707f439bc9d013a48b447d3077c5d620b0a7267dc39","record_count":2,"schema_version":"experimental/v0","to_version":1}
