{"batch_id":"synthetic-002","depends_on_batch_id":"synthetic-001","feed_id":"tech-boundary-synthetic","from_version":1,"generated_at":"2026-09-09T00:05:00Z","generation":"test-v0","min_consumer_version":"0.1.0","payload_bytes":1629,"payload_path":"batch-synthetic-002.jsonl","payload_sha256":"1f1b17f5a8de63a716800502b4733a6698b6731f094e52e4074651c740b6353d","record_count":3,"schema_version":"experimental/v0","to_version":2}
